{
  "audit_id": "AUD-FIXTURE-001",
  "evidence_items": [
    {
      "evidence_id": "EV-001",
      "type": "product_promise",
      "source": "product-brief",
      "source_tier": "secondary",
      "timestamp": "2026-07-16T09:00:00Z",
      "freshness": "fresh",
      "grade": "MEDIUM",
      "confidence": 0.8,
      "provenance": "Copied from the current product brief and checked during audit framing.",
      "is_customer_commercial": false,
      "authority_tier": "tier-2",
      "checked_at": "2026-07-16T09:30:00Z",
      "expiry": "2027-01-16T00:00:00Z",
      "url_health": "not_applicable",
      "content_summary": "The product promises faster evidence-backed positioning decisions."
    }
  ],
  "total_items": 1,
  "types_present": 1,
  "types_missing": 10,
  "evidence_limited_mode": true,
  "schema_version": "v8"
}
